{
  "schemaVersion": "amtech-signed-artifact/v1",
  "certificateId": "amtech:skill:knowledge-graph-builder:c97167ce5efbbb0acf5319e7",
  "subjectType": "skill",
  "subjectId": "knowledge-graph-builder",
  "owner": {
    "name": "AMTECH AI",
    "url": "https://amtechai.com"
  },
  "canonicalUrl": "https://amtechai.com/skills/knowledge-graph-builder",
  "repository": {
    "url": "https://github.com/benamtech/amtech-skills-registry",
    "commit": "88d9ce86525d3e234a37b0c5c7b752fc2beb69bb",
    "path": "skills/knowledge-graph-builder"
  },
  "version": "0.1.0",
  "digests": {
    "sha256": "3bb768a6fd93de086802460c773f21134e39c456ba4af99dc421a7e86deb752e",
    "sha3_512": "c97167ce5efbbb0acf5319e7caf168d85d3acd4d00d0ebb20e5c0e065749d321aa9f82de243f5960897edf570207b1b18905be8c12be7d3fb2b6cd4be1473876"
  },
  "issuedAt": "2026-06-19T00:00:00.000Z",
  "issuer": {
    "name": "AMTECH AI",
    "url": "https://amtechai.com"
  },
  "signingKeyId": "ed25519:2ecc5136b54f570e698487d3",
  "signingKeyUrl": "https://amtechai.com/.well-known/amtech-signing-key.json"
}
