{
  "schemaVersion": "amtech-signed-artifact/v1",
  "certificateId": "amtech:skill:okf-audit:36f53231aa75bab64166abe7",
  "subjectType": "skill",
  "subjectId": "okf-audit",
  "owner": {
    "name": "AMTECH AI",
    "url": "https://amtechai.com"
  },
  "canonicalUrl": "https://amtechai.com/skills/okf-audit",
  "repository": {
    "url": "https://github.com/benamtech/amtech-skills-registry",
    "commit": "88d9ce86525d3e234a37b0c5c7b752fc2beb69bb",
    "path": "skills/okf-audit"
  },
  "version": "0.1.0",
  "digests": {
    "sha256": "c7f1292b9e4b91a539b43b015186a8cc9a7220d0d9a93e62fe6e69e7a643f6a7",
    "sha3_512": "36f53231aa75bab64166abe7c9a8f0761fa335d0f89713c7013fe0ed07e6e1f8e3641537759e8a28626d15ee868bd5766214315aca628e11e1a3da1e7fd9cb7a"
  },
  "issuedAt": "2026-06-19T00:00:00.000Z",
  "issuer": {
    "name": "AMTECH AI",
    "url": "https://amtechai.com"
  },
  "signingKeyId": "ed25519:2ecc5136b54f570e698487d3",
  "signingKeyUrl": "https://amtechai.com/.well-known/amtech-signing-key.json"
}
